{"artifacts":[{"path":"benchmarks/reprocheck_ml_v1/data/annotation-packets-v1/coordinator-mapping.json","sha256":"73831b5eefe1b5ac6f2f172583bdc6b8a0cdcc4d94ad0477cc2260886a0382c8","size_bytes":422559},{"path":"benchmarks/reprocheck_ml_v1/data/materialized-development-v1/corpus.json","sha256":"4acc84d98807662b99c0f3f0e2170d4a504430bf6237604864fb1ee3085385da","size_bytes":283676},{"path":"benchmarks/reprocheck_ml_v1/mutation-amendment-1.md","sha256":"9074b0d87f557c72a3263fa4248f6882c6285fb24d9b26d2a2cdef1e60e5f3f2","size_bytes":776},{"path":"benchmarks/reprocheck_ml_v1/mutation-experiment-v2.json","sha256":"42024b548199ad29d49533ef02f50485dd19bf4c3b17f39ea52c682c0437f906","size_bytes":782},{"path":"benchmarks/reprocheck_ml_v1/run-mutation-experiment.py","sha256":"75c52ee2ba0cc5ab34fb0efab113721cd545f4f2b27f8a5c55de07b4bbbb5b8a","size_bytes":1657},{"path":"src/reprocheck/ml_baselines.py","sha256":"7f90272d824bb424ae34a5ed7a652d94da18464ae06330acccf00075bd6250db","size_bytes":10154},{"path":"src/reprocheck/ml_extraction.py","sha256":"ee0c310486e67d81e1d4b6ed8074ad25dc85dd90c31a3f4f250e1284ec0abafd","size_bytes":7199},{"path":"src/reprocheck/ml_mutation_experiment.py","sha256":"cc22bbb3a720183925e68db715b913275da94255ea0d3134c4e955b383ab490d","size_bytes":7819},{"path":"src/reprocheck/ml_silver_experiment.py","sha256":"d97844531cc7029b2ea680dcbbd1e8b86e3d15567edc7277c0633df2cd429cc4","size_bytes":10442},{"path":"src/reprocheck/ml_split.py","sha256":"13e21801dd6691ce9820c65e9d2c097110942341f4dfd39bfc86183cb6d8b976","size_bytes":8453}],"prospective_sources_acquired":false,"registration_sha256":"ec845d7dc68d3324bacb7394e955d7d4b937079bc5033b3d42d6d414f45292d5","schema_version":"reprocheck.ml-preregistration.v1","status":"registered_not_executed","test_labels_opened":false}
