{"artifacts":[{"path":"benchmarks/reprocheck_ml_v1/acquire.py","sha256":"4d9beb5aefa87f7baf227550e68a89b0f989239f6b6d323e968255ae89645c19","size_bytes":5107},{"path":"benchmarks/reprocheck_ml_v1/annotate.py","sha256":"d4c853c6bad81eb8f66c0a26412d6b64cbc9fc4afb48746d69b66c5f9fb2df9a","size_bytes":199},{"path":"benchmarks/reprocheck_ml_v1/annotation-guide.md","sha256":"82cf13713b29d2e481f8e6d0c570b65edac12c77b617e0fe652f84a10fe4f944","size_bytes":1476},{"path":"benchmarks/reprocheck_ml_v1/calibrate.py","sha256":"cd9868431ee3943d00de7540a20d820d912e8f516eeb332cbe901cace14cd077","size_bytes":103},{"path":"benchmarks/reprocheck_ml_v1/evaluate.py","sha256":"e9a06df077f3c854a9cae22c1afc656d17b33596032496a912626283364620f2","size_bytes":102},{"path":"benchmarks/reprocheck_ml_v1/exclusions.json","sha256":"e15121217992f25002df995cf985db5e138db32f2b52299ed1b171e5ee87a2a1","size_bytes":248},{"path":"benchmarks/reprocheck_ml_v1/model-card.md","sha256":"4fec9dde843a344b87e3dab992c7455c8b652efaaacdf7b59e935ac94da3fd97","size_bytes":1978},{"path":"benchmarks/reprocheck_ml_v1/protocol.json","sha256":"fe3000113d72b67b79e9a6187f00e49a83473aac9b49aeae19995b9805219691","size_bytes":1570},{"path":"benchmarks/reprocheck_ml_v1/protocol.md","sha256":"15e360f099079487a6a065c249860721ad2cd4e22ede38baa929272d7a0b0eb5","size_bytes":915},{"path":"benchmarks/reprocheck_ml_v1/register.py","sha256":"6511f5b3849873ac03514bb43c6d0ee9d9a4d6c70bdead129c8fbbe5abd29471","size_bytes":1586},{"path":"benchmarks/reprocheck_ml_v1/schema/registration-v1.schema.json","sha256":"9b906206ceca27373c8b443757259d2f0d97b64d273c4e7696e81202647392b1","size_bytes":1064},{"path":"benchmarks/reprocheck_ml_v1/source-frame.json","sha256":"73a3018fb31a6a1dc64343de80139d7b81795752f383dd8b039f9159dac80dfa","size_bytes":1338},{"path":"benchmarks/reprocheck_ml_v1/split.py","sha256":"1441647cad007bcea339eb0855c784f8f111f8c7da89a51402ade357b272b29f","size_bytes":99},{"path":"benchmarks/reprocheck_ml_v1/train.py","sha256":"2090464664a1595e9226851e40d534ed8ad8b9af1b38907258002db45c171cf9","size_bytes":99},{"path":"benchmarks/reprocheck_ml_v1/verify-registration.py","sha256":"e6ac77b954525aec32b3e3c47e60832e3ed651c4494fa1e6d6df4bda6d409972","size_bytes":436},{"path":"pyproject.toml","sha256":"de7b065f458366ec726fbfce9b0c2e19c1f8c444508fbcf18f5ef80054c3e86b","size_bytes":2473},{"path":"src/reprocheck/ml_acquisition.py","sha256":"0138a95603ed13d5e4515bce597d84bfd28d5b7e628c2ba01f2e12d1bc06df2a","size_bytes":10925},{"path":"src/reprocheck/ml_baselines.py","sha256":"7f90272d824bb424ae34a5ed7a652d94da18464ae06330acccf00075bd6250db","size_bytes":10154},{"path":"src/reprocheck/ml_calibration.py","sha256":"5ba95d3028df43cfdcefa7d529d15837a9b1e98865f4fad9e1b16ffbe27d8ff1","size_bytes":10387},{"path":"src/reprocheck/ml_contracts.py","sha256":"daefc06eb98ed9e74d760a34bc850a52544e4291e3b5a32fccc5a80acabfda2f","size_bytes":8985},{"path":"src/reprocheck/ml_dataset.py","sha256":"d9e6adc1574c8cea6a8bb84fed014c2d724ceec11ac695eba027bd6d240df62e","size_bytes":8441},{"path":"src/reprocheck/ml_decision.py","sha256":"ff7b6cea876aff152e98b6f2d4c62960f016da8033eaed3714a9b928fd33e7e0","size_bytes":4103},{"path":"src/reprocheck/ml_evaluation.py","sha256":"4d3aa15e04646340af1dd550420f0d64b39d86cd9e02adb4be6abcc6c76b9c44","size_bytes":13480},{"path":"src/reprocheck/ml_extraction.py","sha256":"ee0c310486e67d81e1d4b6ed8074ad25dc85dd90c31a3f4f250e1284ec0abafd","size_bytes":7199},{"path":"src/reprocheck/ml_features.py","sha256":"45d6dbb8c50766f43bf711af82652b2a082ef77a9e926c140f565098ff2692af","size_bytes":1626},{"path":"src/reprocheck/ml_registration.py","sha256":"82c17484c94e4c3fd88676268676b7203abe57c0df8f0f5e1860b9d1fb438858","size_bytes":3852},{"path":"src/reprocheck/ml_reporting.py","sha256":"63ecde72992fd1fe95140d6cfa293cfd122952efdda45184f3f98c3dbb9b001b","size_bytes":3818},{"path":"src/reprocheck/ml_retrieval.py","sha256":"e4563f04926e09e2d929ff901d9acf567523076b636c2691cb61b1161a91a554","size_bytes":11562},{"path":"src/reprocheck/ml_split.py","sha256":"13e21801dd6691ce9820c65e9d2c097110942341f4dfd39bfc86183cb6d8b976","size_bytes":8453},{"path":"src/reprocheck/ml_transformer.py","sha256":"fc9fc3da07b77676ee07c60a488af154ff5deec56009461595ccd4d86208a472","size_bytes":13041},{"path":"uv.lock","sha256":"e8fdc974e90cc7b0f22ccfaefdd6283f88750035ef2513c58e06ba45386e7e11","size_bytes":499129}],"prospective_sources_acquired":false,"registration_sha256":"d533d66dd79af242d15b2f3829e84c931fcd9f955905f153051132ca2105c458","schema_version":"reprocheck.ml-preregistration.v1","status":"registered_not_executed","test_labels_opened":false}
