{"artifacts":[{"path":"benchmarks/reprocheck_ml_v1/acquire.py","sha256":"4d9beb5aefa87f7baf227550e68a89b0f989239f6b6d323e968255ae89645c19","size_bytes":5107},{"path":"benchmarks/reprocheck_ml_v1/data/discovery-development-v2.json","sha256":"7e63ade355623ee42420448298f80a5153df365abb755389edb6b19d27bba8f7","size_bytes":47455},{"path":"benchmarks/reprocheck_ml_v1/materialization-rules-v1.json","sha256":"913b9f7ac122d2eb8bb6a8409446fa78cc717e25f592f1e62465c7cca624f00f","size_bytes":1033},{"path":"benchmarks/reprocheck_ml_v1/materialize.py","sha256":"77df764b2ab91fbed52267e0073436abfb24da25ee3c7bb091d7674f24ea0ea1","size_bytes":3043},{"path":"benchmarks/reprocheck_ml_v1/register-materialization.py","sha256":"38febca3c720ba3a0dc7bfacdffc2516904b60bb01e66da6a459b0378a473fc5","size_bytes":981},{"path":"benchmarks/reprocheck_ml_v1/registration-v2.json","sha256":"74cd96329a24668dd6358f7f3dfad7a141594642df2a0cdc9c6fd756d5087d68","size_bytes":2127},{"path":"benchmarks/reprocheck_ml_v1/verify-materialization-registration.py","sha256":"066cb8005def6285c52e52405c48713b9c68cd85f3f87e710cbc0693921c6fd9","size_bytes":424},{"path":"src/reprocheck/ml_contracts.py","sha256":"daefc06eb98ed9e74d760a34bc850a52544e4291e3b5a32fccc5a80acabfda2f","size_bytes":8985},{"path":"src/reprocheck/ml_materialization.py","sha256":"9c7723a0a5c98e6f714d397bbd41d3730307a3972ac69cb62b38645c4e8a3555","size_bytes":17664},{"path":"src/reprocheck/ml_registration.py","sha256":"82c17484c94e4c3fd88676268676b7203abe57c0df8f0f5e1860b9d1fb438858","size_bytes":3852}],"prospective_sources_acquired":false,"registration_sha256":"60be601f313249e9af3def2a1af29977b5e15d0175354ea58513d6b956aae6ad","schema_version":"reprocheck.ml-preregistration.v1","status":"registered_not_executed","test_labels_opened":false}
