{"artifacts":[{"path":"benchmarks/reprocheck_ml_v1/annotation-guide.md","sha256":"82cf13713b29d2e481f8e6d0c570b65edac12c77b617e0fe652f84a10fe4f944","size_bytes":1476},{"path":"benchmarks/reprocheck_ml_v1/annotation-sampling-v1.json","sha256":"7c2571f13da47886a5b63ec932796f580d62e7656ac06b9988130140471a286f","size_bytes":494},{"path":"benchmarks/reprocheck_ml_v1/data/materialized-development-v1/corpus.json","sha256":"4acc84d98807662b99c0f3f0e2170d4a504430bf6237604864fb1ee3085385da","size_bytes":283676},{"path":"benchmarks/reprocheck_ml_v1/data/materialized-development-v1/materialization.json","sha256":"952b2a46ebefdfc3b39fa03eda693ccd25fe01d337178d61d90354ac4740b894","size_bytes":757914},{"path":"benchmarks/reprocheck_ml_v1/prepare-annotation.py","sha256":"a1e1c44919228b265832411b57b6bb6da74c572dbe70e5bb80329724b916a9c9","size_bytes":684},{"path":"benchmarks/reprocheck_ml_v1/register-annotation.py","sha256":"c5155d4c1145ccaeee0512b452e4aef59c25ef70c00262ea6dfddf117aed2f5d","size_bytes":962},{"path":"src/reprocheck/ml_annotation_packet.py","sha256":"2f4b20f70ec20faeb1486d99e68d5a9c3d28260a266c95c11197b50a84d1dffc","size_bytes":6235},{"path":"src/reprocheck/ml_extraction.py","sha256":"ee0c310486e67d81e1d4b6ed8074ad25dc85dd90c31a3f4f250e1284ec0abafd","size_bytes":7199},{"path":"src/reprocheck/ml_registration.py","sha256":"82c17484c94e4c3fd88676268676b7203abe57c0df8f0f5e1860b9d1fb438858","size_bytes":3852}],"prospective_sources_acquired":false,"registration_sha256":"bdc9c904451b94ace10fda95d534815746e7b6199896baa2db4e238d0e478c7e","schema_version":"reprocheck.ml-preregistration.v1","status":"registered_not_executed","test_labels_opened":false}
