{"artifacts":[{"path":"benchmarks/reprocheck_ml_v1/acquire-v2.py","sha256":"2e34fe4a947e63f71dcdc39b1f16b97bd5f5580944b30100ce2b7eeeb4bd67de","size_bytes":1743},{"path":"benchmarks/reprocheck_ml_v1/acquire.py","sha256":"4d9beb5aefa87f7baf227550e68a89b0f989239f6b6d323e968255ae89645c19","size_bytes":5107},{"path":"benchmarks/reprocheck_ml_v1/amendment-001.md","sha256":"7cd0150db8c0e62e79b567abbd4f138e5bfd6ddba0849e864d47812069a8462a","size_bytes":939},{"path":"benchmarks/reprocheck_ml_v1/data/discovery-development.json","sha256":"1debba761fd3c94d898a4241a98856176f0dcbfd2e7e881d2b4d4a25b3a35133","size_bytes":46293},{"path":"benchmarks/reprocheck_ml_v1/register-v2.py","sha256":"cb36448601c5ce529e49ff509d84212b5c67b764bba999be905bb5ac21daf584","size_bytes":1029},{"path":"benchmarks/reprocheck_ml_v1/registration.json","sha256":"82423577676de1771308b33c3d8f7cb6c8cee4aeb9f7d7642f15b333092534c1","size_bytes":4619},{"path":"benchmarks/reprocheck_ml_v1/source-frame-v2.json","sha256":"be19efd96182bee1f3fa2ef1de5c59205aa709c8b7fc38bd34e0e859354066a7","size_bytes":1557},{"path":"benchmarks/reprocheck_ml_v1/verify-registration-v2.py","sha256":"066cb8005def6285c52e52405c48713b9c68cd85f3f87e710cbc0693921c6fd9","size_bytes":424},{"path":"pyproject.toml","sha256":"de7b065f458366ec726fbfce9b0c2e19c1f8c444508fbcf18f5ef80054c3e86b","size_bytes":2473},{"path":"src/reprocheck/ml_acquisition.py","sha256":"0138a95603ed13d5e4515bce597d84bfd28d5b7e628c2ba01f2e12d1bc06df2a","size_bytes":10925},{"path":"src/reprocheck/ml_acquisition_v2.py","sha256":"7c85529ddb3dba1caeef07f6acb9b748288a426b242a722adb15c8e42b37d322","size_bytes":9252},{"path":"src/reprocheck/ml_registration.py","sha256":"82c17484c94e4c3fd88676268676b7203abe57c0df8f0f5e1860b9d1fb438858","size_bytes":3852},{"path":"uv.lock","sha256":"e8fdc974e90cc7b0f22ccfaefdd6283f88750035ef2513c58e06ba45386e7e11","size_bytes":499129}],"prospective_sources_acquired":false,"registration_sha256":"9921cc4fc2e49da5bd1f3e4e6e018a5f3781aa2db839ec2fed2bf01f4367d94e","schema_version":"reprocheck.ml-preregistration.v1","status":"registered_not_executed","test_labels_opened":false}
